Id,Condition,Price,Location,Model_Year,Mileage,Exterior_Color,Make,Warranty,Model
1614,Used,8500.0,"Chambersburg, Pennsylvania, United States",2001,28000,Purple,Harley-Davidson,No,Touring
1615,Used,16999.0,"Long Branch, New Jersey, United States",2014,18469,Black,Harley-Davidson,No,Touring
1616,Used,8599.0,"Williston, Vermont, United States",2015,2950,Silver,Harley-Davidson,No,Sportster
1617,Used,7000.0,"Bronx, New York, United States",2009,37737,Orange,Harley-Davidson,No,Street
1619,Used,11000.0,"New Lenox, Illinois, United States",2016,670,White,Triumph,Yes,Bonneville
1621,Used,8777.0,"Mansfield, Texas, United States",2002,30113,Red,Harley-Davidson,No,Softail Fat Boy
1622,Used,7500.0,"Fort Myers, Florida, United States",1993,36000,Black,Harley-Davidson,No,Softail
1625,Used,3200.0,"Bloomington, Indiana, United States",1974,8829,Green,Yamaha,No,Dt360
1626,Used,4000.0,"Lathrop, California, United States",2007,4111,Black,Harley-Davidson,No,V-Rod
1627,Used,11200.0,"Willoughby, Ohio, United States",2003,8100,Metallic,Harley-Davidson,No,Softail
1628,Used,6700.0,"Glenview, Illinois, United States",2000,26800,Blue,Honda,No,Valkyrie
1629,Used,1000.0,"Gratiot, Wisconsin, United States",1984,4350,Red,Honda,No,XL
1630,Used,8300.0,"Bristol, Connecticut, United States",2002,35300,Red,Harley-Davidson,No,Softail
1632,Used,5500.0,"Glenwood, Illinois, United States",2008,20000,Red,Honda,No,CBR
1633,Used,18500.0,"Land O&#039; Lakes, Florida, United States",2013,6065,Red,Harley-Davidson,No,Touring
1634,Used,28500.0,"Searcy, Arkansas, United States",2016,1443,Red,Honda,Yes,Gold Wing
1635,Used,10899.0,"Grapevine, Texas, United States",2015,7720,Black,Harley-Davidson,No,Dyna
1637,Used,12995.0,"Dumfries, Virginia, United States",2016,624,Black,Harley-Davidson,No,Dyna
1638,Used,21500.0,"Bonita Springs, Florida, United States",2013,3600,Red,Harley-Davidson,No,FXSBSE
1640,Used,3050.0,"Hays, Kansas, United States",1983,1150,Other,Harley-Davidson,No,Dyna
1643,Used,4000.0,"East Otto, New York, United States",1985,29586,Other,Harley-Davidson,No,FXR
1644,Used,4500.0,"Wildwood, New Jersey, United States",2001,14000,Yellow,Harley-Davidson,No,Low Rider
1645,Used,10500.0,"Tampa, Florida, United States",2010,35467,Red,Harley-Davidson,No,Touring
1646,Used,13900.0,"Temple City, California, United States",2008,2184,Other,Harley-Davidson,No,Softail
1647,Used,7788.0,"Tulsa, Oklahoma, United States",2014,8350,Black,Harley-Davidson,No,Sportster
1648,Used,765.0,"Anacortes, Washington, United States",1969,3212,Red,Honda,No,Other
1649,Used,1500.0,"McHenry, Illinois, United States",2008,2844,Black,Yamaha,No,V Star
1650,Used,18800.0,"Newport Beach, California, United States",1959,30690,Black,BMW,No,R-Series
1651,Used,3250.0,"Delaware, Ohio, United States",1997,8200,Red,Harley-Davidson,No,Sportster
1652,Used,21280.0,"Mansfield, Texas, United States",2016,2419,Black,Harley-Davidson,No,Freewheeler Trike
1653,Used,5200.0,"Plainfield, Illinois, United States",2003,7500,Blue,Suzuki,No,GSX-R
1654,Used,28400.0,"Alachua, Florida, United States",2016,841,Silver,Harley-Davidson,No,Tri Glide
1655,Used,2500.0,"Auburn, Washington, United States",1975,3657,Blue,Honda,No,CB
1656,Used,7995.0,"Zieglerville, Pennsylvania, United States",2005,15533,Blue,Harley-Davidson,No,Dyna
1657,Used,14500.0,"Philadelphia, Pennsylvania, United States",2014,1867,Black,Harley-Davidson,No,Fat Bob
1658,Used,10999.0,"Gordon, Wisconsin, United States",2013,1300,Brown,Harley-Davidson,Yes,Dyna
1661,Used,7500.0,"Chilhowie, Virginia, United States",2003,13319,Blue,Harley-Davidson,No,Dyna
1662,Used,29500.0,"Lima, Ohio, United States",2013,34911,Blue,Honda,Yes,Gold Wing
1666,Used,14000.0,"Peoria, Illinois, United States",2009,20500,Other,Harley-Davidson,No,Touring
1667,Used,2095.0,"Middle Village, New York, United States",2007,18729,Blue,Kawasaki,Yes,Ninja
1668,Used,15000.0,"Mobile, Alabama, United States",2015,5100,Other,Harley-Davidson,No,Touring
1670,Used,5900.0,"Westmont, Illinois, United States",2009,8900,Orange,Suzuki,No,GSX-R
1672,Used,7488.0,"Mansfield, Texas, United States",2006,34017,Red,Harley-Davidson,No,Softail Fat Boy
1674,Used,1000.0,"Hortonville, Wisconsin, United States",2007,32295,Silver,Harley-Davidson,No,Touring
1675,Used,11900.0,"Park City, Utah, United States",2009,28200,Red,BMW,No,R-Series
1676,Used,22900.0,Punta del Este,1938,111,Black,BMW,No,R-Series
1677,Used,3500.0,"Naples, Florida, United States",2015,265,Black,Honda,Yes,Grom
1679,Used,8599.0,"Williston, Vermont, United States",2015,2950,Silver,Harley-Davidson,No,Sportster
1681,Used,9779.0,"Arlington, Texas, United States",2008,33284,Orange,Harley-Davidson,No,Softail Fat Boy
1683,Used,11000.0,"New Lenox, Illinois, United States",2016,670,White,Triumph,Yes,Bonneville
1684,Used,1475.0,"Villa Park, Illinois, United States",1970,3712,Red,Honda,No,CT
1686,Used,8995.0,"Staten Island, New York, United States",2007,6898,Other,Harley-Davidson,No,V-Rod
1687,Used,10290.0,"Bluefield, West Virginia, United States",2012,1911,Red,Harley-Davidson,No,Dyna
1688,Used,11899.0,"Winston-Salem, North Carolina, United States",2014,22424,Black,Harley-Davidson,No,Dyna
1689,Used,5900.0,"Boca Raton, Florida, United States",1999,21000,Blue,BMW,No,R-Series
1690,Used,4550.0,"Columbus, Ohio, United States",2013,1894,Red,Honda,No,CB
1692,Used,15788.0,"Tulsa, Oklahoma, United States",2013,8992,Black,Harley-Davidson,No,Touring
1693,Used,7993.0,"Arlington, Texas, United States",2002,14624,Red,Harley-Davidson,No,Softail Fat Boy
1694,Used,1500.0,"McHenry, Illinois, United States",2008,2844,Black,Yamaha,No,V Star
1695,Used,5000.0,"Jessup, Maryland, United States",1998,20466,Black,BMW,No,R-Series
1696,Used,9000.0,"Belmont, Ohio, United States",2000,18800,Other,Harley-Davidson,No,Softail
1697,Used,6500.0,"Hobe Sound, Florida, United States",2000,26600,Other,Harley-Davidson,No,Softail
1698,Used,3050.0,"Brookfield, Connecticut, United States",1957,3856,Black,BMW,No,R-Series
1699,Used,23999.0,"Brilliant, Ohio, United States",2014,16433,Blue,Harley-Davidson,Yes,Touring
1700,Used,9779.0,"Arlington, Texas, United States",2008,33284,Orange,Harley-Davidson,No,Softail Fat Boy
1701,Used,11000.0,"New Lenox, Illinois, United States",2016,670,White,Triumph,Yes,Bonneville
1703,Used,1475.0,"Villa Park, Illinois, United States",1970,3712,Red,Honda,No,CT
1704,Used,7500.0,"Winston-Salem, North Carolina, United States",2013,5000,Blue,Harley-Davidson,No,Sportster
1706,Used,8995.0,"Staten Island, New York, United States",2007,6898,Other,Harley-Davidson,No,V-Rod
1707,Used,10290.0,"Bluefield, West Virginia, United States",2012,1911,Red,Harley-Davidson,No,Dyna
1708,Used,11899.0,"Winston-Salem, North Carolina, United States",2014,22424,Black,Harley-Davidson,No,Dyna
1709,Used,5900.0,"Boca Raton, Florida, United States",1999,21000,Blue,BMW,No,R-Series
1710,Used,4550.0,"Columbus, Ohio, United States",2013,1894,Red,Honda,No,CB
1712,Used,7993.0,"Arlington, Texas, United States",2002,14624,Red,Harley-Davidson,No,Softail Fat Boy
1713,Used,1500.0,"McHenry, Illinois, United States",2008,2844,Black,Yamaha,No,V Star
1714,Used,5000.0,"Jessup, Maryland, United States",1998,20466,Black,BMW,No,R-Series
1715,Used,9000.0,"Belmont, Ohio, United States",2000,18800,Other,Harley-Davidson,No,Softail
1716,Used,6500.0,"Hobe Sound, Florida, United States",2000,26600,Other,Harley-Davidson,No,Softail
1717,Used,3050.0,"Brookfield, Connecticut, United States",1957,3856,Black,BMW,No,R-Series
1718,Used,16000.0,"Herman, Nebraska, United States",2013,12600,Yellow,Harley-Davidson,No,Touring
1719,Used,13988.0,"Tulsa, Oklahoma, United States",2014,646,Red,Harley-Davidson,No,Softail
1720,Used,28500.0,"Searcy, Arkansas, United States",2016,1443,Red,Honda,Yes,Gold Wing
1721,Used,16000.0,"Staten Island, New York, United States",2015,11436,Blue,Harley-Davidson,No,Road Glide
1722,Used,10000.0,"Punta Gorda, Florida, United States",2002,3000,Black,Harley-Davidson,No,Softail
1723,Used,3500.0,"Wadsworth, Ohio, United States",1980,3958,Black,Kawasaki,No,KZ1000G
1724,Used,21000.0,"Gainesville, Florida, United States",2014,9021,Orange,Harley-Davidson,No,CVO Breakout
1725,Used,910.0,"Glen Cove, New York, United States",1980,12292,Red,Honda,No,Other
1726,Used,6993.0,"Arlington, Texas, United States",2004,18586,Black,Harley-Davidson,No,Softail Standard
1729,Used,8995.0,"Zieglerville, Pennsylvania, United States",2010,9437,Black,Harley-Davidson,No,Dyna
1730,Used,8222.0,"Mansfield, Texas, United States",2009,25725,White,Harley-Davidson,No,Road King
1731,Used,5995.0,"Columbus, Georgia, United States",2013,3191,Other,Yamaha,No,VSTAR TOURING
1732,Used,18400.0,"Fort Lauderdale, Florida, United States",2010,2134,Metallic,Harley-Davidson,No,V-Rod
1733,Used,3550.0,"Wilmington, North Carolina, United States",2005,19560,Red,Harley-Davidson,No,V-Rod
1734,Used,3050.0,"Scottsdale, Arizona, United States",2006,4999,Red,Harley-Davidson,No,Softail
1735,New,20499.0,"Searcy, Arkansas, United States",2016,121,Silver,Honda,Yes,Gold Wing
1737,Used,13333.0,"Arlington, Texas, United States",2014,11742,Gray,Harley-Davidson,No,Heritage Softail
1738,Used,3500.0,"Boynton Beach, Florida, United States",1997,20779,Gray,BMW,No,R-Series
1739,Used,11600.0,"Riverview, Florida, United States",1977,2000,Blue,Harley-Davidson,No,Harley Davidson
1740,Used,13998.0,"Bedford, Texas, United States",2001,28641,Black,Harley-Davidson,No,FLHTCI
1741,Used,7495.0,"Zieglerville, Pennsylvania, United States",2007,30794,Red,Harley-Davidson,No,Dyna
1743,Used,14995.0,"Plainville, Connecticut, United States",2016,1121,Blue,Harley-Davidson,Yes,FLSTC - Heritage Softail Classic
1744,Used,12000.0,"Waterloo, South Carolina, United States",2002,19937,Other,Harley-Davidson,No,Softail
1747,Used,5700.0,"Pickerington, Ohio, United States",2004,7500,Other,Harley-Davidson,No,Sportster
1749,Used,3500.0,"Rockford, Michigan, United States",1971,8521,Blue,Honda,No,CL
1750,Used,6106.0,"Middletown, New Jersey, United States",2002,7600,Blue,Harley-Davidson,No,Road King
1751,Used,1500.0,"South Berwick, Maine, United States",1969,500,Black,Honda,No,Other
1752,Used,12795.0,"Staten Island, New York, United States",2014,3244,Other,Harley-Davidson,No,V-Rod
1753,Used,5499.0,"Trenton, Tennessee, United States",1997,2000,Black,Harley-Davidson,No,Dyna
1755,Used,4000.0,"Pikesville, Maryland, United States",2006,15102,Black,Harley-Davidson,No,Sportster
1757,Used,6000.0,"New Milford, New Jersey, United States",2008,5200,Other,Harley-Davidson,No,Sportster
1758,Used,4499.0,"Norwalk, Ohio, United States",2008,4286,Blue,Harley-Davidson,No,Sportster
1760,Used,3700.0,"Carpentersville, Illinois, United States",1986,4939,White,Yamaha,No,FJ 1200
1761,Used,3799.0,"Orlando, Florida, United States",2005,2790,Other,Harley-Davidson,No,Sportster
1762,Used,6000.0,"Kingston, New York, United States",2005,2979,Red,Harley-Davidson,No,Sportster
1763,Used,3499.0,"Horsham, Pennsylvania, United States",2005,3160,Blue,Harley-Davidson,No,Sportster
1764,Used,4000.0,"Alpena, Michigan, United States",2001,3858,Purple,Harley-Davidson,No,Dyna
1765,Used,29500.0,"Lima, Ohio, United States",2010,17416,Metallic,Honda,No,Gold Wing
1766,Used,13499.0,"Mount Holly, New Jersey, United States",1961,10641,Purple,Harley-Davidson,No,PANHEAD
1767,Used,6000.0,"Stroudsburg, Pennsylvania, United States",1981,33000,Other,Harley-Davidson,No,FXE
1770,Used,7995.0,"Broomall, Pennsylvania, United States",2014,3900,Black,Harley-Davidson,No,Sportster
1772,Used,13900.0,"Wayzata, Minnesota, United States",2012,3080,Black,Harley-Davidson,No,Dyna
1774,Used,9777.0,"Mansfield, Texas, United States",2010,17789,Silver,Harley-Davidson,No,Electra Glide
1776,Used,6700.0,"Nashville, Tennessee, United States",2003,26352,Black,Harley-Davidson,No,Sportster
1777,Used,1225.0,"Wadsworth, Ohio, United States",1973,35896,Other,Honda,No,CB
1778,Used,18000.0,"Little River, South Carolina, United States",2013,3400,Other,Harley-Davidson,No,Sportster
1779,Used,1475.0,"Schenectady, New York, United States",1978,36459,Black,Honda,No,Gold Wing
1780,Used,9888.0,"Tulsa, Oklahoma, United States",2007,34609,Silver,Harley-Davidson,No,Touring
1782,Used,10998.0,"Mansfield, Texas, United States",2015,15667,Other,Harley-Davidson,No,Dyna Low Rider
1784,Used,3050.0,"Cincinnati, Ohio, United States",2003,22050,Metallic,Harley-Davidson,No,Dyna
1785,Used,2299.0,"Necedah, Wisconsin, United States",1982,37642,Black,Honda,No,Gold Wing
1788,Used,8299.0,"Acworth, Georgia, United States",2000,11100,Blue,Harley-Davidson,No,Softail
1789,Used,4900.0,"Leesburg, Florida, United States",2003,33654,Red,Harley-Davidson,No,V-Rod
1790,Used,7500.0,"Winston-Salem, North Carolina, United States",2013,5000,Blue,Harley-Davidson,No,Sportster
1791,Used,7800.0,"Harwood, Maryland, United States",1964,36000,Other,Harley-Davidson,No,Duoglide
1793,Used,19998.0,"Arlington, Texas, United States",2014,1527,Black,Harley-Davidson,No,Ultra Limited
1794,Used,8995.0,"Leesburg, Florida, United States",2009,9414,Other,Harley-Davidson,No,Thunder Mountain Spitfire
1795,Used,13000.0,"Ridgeway, Virginia, United States",2013,5428,Other,Harley-Davidson,No,Dyna
1796,Used,7000.0,"San Tan Valley, Arizona, United States",1976,2500,Other,Honda,No,CB
1797,Used,7000.0,"Manhattan, Kansas, United States",2006,14335,Red,Harley-Davidson,No,Dyna
1799,Used,1075.0,"Circle Pines, Minnesota, United States",1973,21000,Orange,Honda,No,CB
1800,Used,7000.0,"Manhattan, Kansas, United States",2006,14335,Red,Harley-Davidson,No,Dyna
1802,Used,1075.0,"Circle Pines, Minnesota, United States",1973,21000,Orange,Honda,No,CB
1803,Used,14500.0,"Black River Falls, Wisconsin, United States",2004,12700,Orange,Harley-Davidson,No,Touring
1804,Used,910.0,"Glen Cove, New York, United States",1980,12292,Red,Honda,No,Other
1805,Used,25900.0,"Hillsborough, North Carolina, United States",2011,39768,Other,Harley-Davidson,No,Touring
1806,Used,9499.0,"Anoka, Minnesota, United States",2012,26500,Black,Harley-Davidson,No,Dyna
1807,Used,9995.0,"Canton, Connecticut, United States",2013,4029,Black,Kawasaki,Yes,Concours 14
1808,Used,1576.0,"West Farmington, Ohio, United States",1976,11879,Brown,Honda,No,CB
1809,Used,13000.0,"Florissant, Missouri, United States",2013,24200,Other,Harley-Davidson,No,Other
1810,Used,5995.0,"Columbus, Georgia, United States",2013,3191,Other,Yamaha,No,VSTAR TOURING
1812,Used,2462.0,"Monclova, Ohio, United States",2004,3136,Orange,Honda,No,VTX
1813,Used,10200.0,"Homestead, Florida, United States",2012,9297,Black,Harley-Davidson,No,Dyna
1814,Used,14500.0,"Yorba Linda, California, United States",2007,1200,Other,Harley-Davidson,No,Custom
1815,Used,10000.0,"Scottsdale, Arizona, United States",2008,27802,Black,Harley-Davidson,No,Touring
1816,Used,8000.0,"Minneapolis, Minnesota, United States",2009,1650,Other,Harley-Davidson,No,Dyna
1817,Used,7500.0,"San Tan Valley, Arizona, United States",2005,16889,Red,Harley-Davidson,No,Dyna
1819,Used,14995.0,"Lake Lure, North Carolina, United States",2014,6050,Metallic,BMW,No,R-Series
1820,Used,8999.0,"Irvine, California, United States",1998,16600,Other,Harley-Davidson,No,Dyna
1822,Used,7500.0,"Akron, Ohio, United States",2006,6800,White,Harley-Davidson,No,Dyna
1824,Used,3900.0,"Grand Rapids, Michigan, United States",1984,6300,Red,Honda,No,Gold Wing
1825,Used,18000.0,"Rugby, North Dakota, United States",2016,1800,White,Other,Yes,Slingshot
1826,Used,18500.0,"Milton, Vermont, United States",2015,6771,Black,Harley-Davidson,Yes,Street Glide
1827,Used,12000.0,"Hickory, North Carolina, United States",2004,37000,Red,Harley-Davidson,No,Touring
1828,Used,8995.0,"Zieglerville, Pennsylvania, United States",2010,16952,Black,Harley-Davidson,No,Dyna
1829,Used,10500.0,"Splendora, Texas, United States",2007,31113,Silver,Honda,No,Gold Wing
1831,Used,11300.0,"Mount Clare, West Virginia, United States",2016,6340,Black,Harley-Davidson,No,Street
1832,Used,5700.0,"Pickerington, Ohio, United States",2004,7500,Other,Harley-Davidson,No,Sportster
1833,Used,6999.0,"Arlington, Texas, United States",2014,4406,Black,Harley-Davidson,No,Sportster 1200
1834,Used,7459.0,"Arlington, Texas, United States",2006,19680,White,Harley-Davidson,No,Dyna Super Glide
1835,Used,1713.0,"Mesa, Arizona, United States",1975,9685,Red,Honda,No,Other
1837,Used,5250.0,"Manhattan Beach, California, United States",1996,15676,Red,BMW,No,R-Series
1838,Used,3950.0,"Baldwin, Maryland, United States",1965,37364,Black,BMW,No,R-Series
1839,Used,6987.0,"Mansfield, Texas, United States",2014,14605,Orange,Harley-Davidson,No,Sportster 1200
1840,Used,9222.0,"Mansfield, Texas, United States",2009,16492,Other,Harley-Davidson,No,Softail Fat Boy
1842,Used,4500.0,"Walled Lake, Michigan, United States",2012,13750,Black,Kawasaki,No,Ninja
1843,Used,7220.0,"Mansfield, Texas, United States",2014,1588,Black,Harley-Davidson,No,Sportster 1200
1844,Used,5000.0,"Dubuque, Iowa, United States",2001,23000,Other,Honda,No,CBR
1846,Used,8500.0,"Chattanooga, Tennessee, United States",2003,20368,Red,Honda,No,Gold Wing
1849,Used,100.0,"Katy, Texas, United States",1981,1000,Black,Harley-Davidson,No,Sportster
1850,Used,1000.0,"Youngstown, Ohio, United States",1977,6635,Other,Kawasaki,No,KZ 750
1851,Used,5000.0,"Bethlehem, Pennsylvania, United States",2005,14000,Blue,Harley-Davidson,No,Sportster
1852,Used,9777.0,"Mansfield, Texas, United States",2010,17789,Silver,Harley-Davidson,No,Electra Glide
1853,Used,2400.0,"Indianapolis, Indiana, United States",2007,1451,Black,Honda,No,Rebel
1854,Used,6900.0,"Lathrop, California, United States",2000,39632,White,Honda,No,Gold Wing
1855,Used,1500.0,"Allentown, Pennsylvania, United States",1970,14722,Gold,Honda,No,CB350
1856,Used,9888.0,"Tulsa, Oklahoma, United States",2007,34609,Silver,Harley-Davidson,No,Touring
1857,Used,10998.0,"Mansfield, Texas, United States",2015,15667,Other,Harley-Davidson,No,Dyna Low Rider
1859,Used,10100.0,"Suncook, New Hampshire, United States",2015,2040,Black,BMW,No,R-Series
1861,Used,4900.0,"Leesburg, Florida, United States",2003,33654,Red,Harley-Davidson,No,V-Rod
1862,Used,4900.0,"Leesburg, Florida, United States",1983,21046,Blue,Harley-Davidson,No,FXR
1863,Used,2100.0,"Fort Edward, New York, United States",1983,16100,Red,Honda,No,CB
1864,Used,7800.0,"Harwood, Maryland, United States",1964,36000,Other,Harley-Davidson,No,Duoglide
1866,Used,4525.0,"Anchorage, Alaska, United States",1996,17368,Red,BMW,No,R-Series
1869,Used,19998.0,"Arlington, Texas, United States",2014,1527,Black,Harley-Davidson,No,Ultra Limited
1871,Used,8995.0,"Leesburg, Florida, United States",2009,9414,Other,Harley-Davidson,No,Thunder Mountain Spitfire
1873,Used,1075.0,"New Orleans, Louisiana, United States",2017,650,Gray,Kawasaki,Yes,z125 Pro
1874,Used,10000.0,"Beavertown, Pennsylvania, United States",2016,1800,Black,Other,Yes,Polaris Slingshot
1875,Used,1125.0,"Danbury, Connecticut, United States",2012,8750,Black,Kawasaki,No,Other
1876,Used,5600.0,"Elizabeth, Indiana, United States",2009,21750,Blue,Harley-Davidson,No,Sportster
1877,Used,7995.0,"Dumfries, Virginia, United States",2007,18949,Red,Harley-Davidson,No,Sportster
1878,Used,6000.0,"Lubbock, Texas, United States",2003,32869,Black,Harley-Davidson,No,Dyna
1883,Used,18000.0,"Rugby, North Dakota, United States",2016,1800,White,Other,Yes,Slingshot
1884,Used,9795.0,"Zieglerville, Pennsylvania, United States",2010,11218,Purple,Harley-Davidson,No,Dyna
1885,Used,14777.0,"Manheim, Pennsylvania, United States",2015,3513,Gold,Harley-Davidson,No,Softail
1886,Used,9995.0,"Canton, Connecticut, United States",2013,4029,Black,Kawasaki,Yes,Concours 14
1888,Used,13000.0,"Florissant, Missouri, United States",2013,24200,Other,Harley-Davidson,No,Other
1889,Used,2462.0,"Monclova, Ohio, United States",2004,3136,Orange,Honda,No,VTX
1890,Used,5700.0,"Lebanon, Missouri, United States",2010,23400,Black,Honda,No,Gold Wing
1891,Used,14500.0,"Yorba Linda, California, United States",2007,1200,Other,Harley-Davidson,No,Custom
1892,Used,280.0,"Fort Defiance, Virginia, United States",1976,21919,Red,Honda,No,CB500T
1893,Used,5000.0,"Edwards, Missouri, United States",2000,36617,Black,Harley-Davidson,No,Dyna
1895,Used,1500.0,"Chillicothe, Ohio, United States",1973,9999,Green,Honda,No,CB750 chopper
1896,Used,8499.0,"Winston-Salem, North Carolina, United States",2015,6325,Black,Harley-Davidson,No,Sportster
1898,Used,1000.0,"Niles, Michigan, United States",2016,1200,Red,Indian,No,Springfield
1899,Used,3900.0,"Atwater, California, United States",2001,18300,Black,BMW,No,R-Series
1900,Used,3000.0,"Kannapolis, North Carolina, United States",1975,19679,Blue,Honda,No,CB
1901,Used,18500.0,"Milton, Vermont, United States",2015,6771,Black,Harley-Davidson,Yes,Street Glide
1903,Used,6000.0,"Oak Grove, Kentucky, United States",1998,18000,Black,Harley-Davidson,No,Softail
1904,Used,1000.0,"Washoe Valley, Nevada, United States",1990,21000,Other,Harley-Davidson,No,Softail
1907,Used,11300.0,"Mount Clare, West Virginia, United States",2016,6340,Black,Harley-Davidson,No,Street
1908,Used,6999.0,"Arlington, Texas, United States",2014,4406,Black,Harley-Davidson,No,Sportster 1200
1909,Used,910.0,"Saint Clair, Michigan, United States",1981,17165,Blue,Honda,No,CB
1910,Used,3550.0,"Utopia, Texas, United States",2002,38673,Silver,Honda,No,Gold Wing
1912,Used,7459.0,"Arlington, Texas, United States",2006,19680,White,Harley-Davidson,No,Dyna Super Glide
1913,Used,3400.0,"Greenville, South Carolina, United States",2004,16000,Black,Honda,No,CB
1914,Used,6987.0,"Mansfield, Texas, United States",2014,14605,Orange,Harley-Davidson,No,Sportster 1200
1915,Used,9222.0,"Mansfield, Texas, United States",2009,16492,Other,Harley-Davidson,No,Softail Fat Boy
1916,Used,12250.0,"O&#039;Fallon, Missouri, United States",2010,33500,Red,Harley-Davidson,No,Touring
1918,Used,100.0,"McHenry, Illinois, United States",2009,29275,Blue,Harley-Davidson,No,Touring
1919,Used,7220.0,"Mansfield, Texas, United States",2014,1588,Black,Harley-Davidson,No,Sportster 1200
1921,Used,9000.0,"Southfield, Michigan, United States",2007,10650,Silver,Ducati,No,Sport Touring
1922,Used,100.0,"Katy, Texas, United States",1981,1000,Black,Harley-Davidson,No,Sportster
1923,Used,5300.0,"Mount Pleasant, Pennsylvania, United States",2002,9432,Silver,Harley-Davidson,No,V-Rod
1924,Used,4500.0,"Whitinsville, Massachusetts, United States",2005,24168,Black,Yamaha,No,R1
1925,Used,27288.0,"Tulsa, Oklahoma, United States",2014,10586,Blue,Harley-Davidson,No,Touring
1926,Used,7500.0,"Parker, Colorado, United States",2004,4590,Blue,Harley-Davidson,No,V-Rod
1927,Used,3100.0,"Signal Hill, California, United States",1978,1000,Other,Honda,No,CB
1928,Used,8800.0,"Thousand Oaks, California, United States",2009,37894,Blue,Harley-Davidson,No,Touring
1929,Used,4499.0,"Pittsburgh, Pennsylvania, United States",2008,13168,Red,Harley-Davidson,No,Sportster
1931,Used,6100.0,"Scott City, Missouri, United States",2016,14860,Black,Harley-Davidson,Yes,Dyna Fat Bob
1932,Used,4125.0,"Barrington, Illinois, United States",2011,6200,Black,Triumph,No,Other
1933,Used,10100.0,"Suncook, New Hampshire, United States",2015,2040,Black,BMW,No,R-Series
1934,Used,2100.0,"Fort Edward, New York, United States",1983,16100,Red,Honda,No,CB
1935,Used,12000.0,"Inlet, New York, United States",2006,7800,Other,Harley-Davidson,No,V-Rod
1939,Used,4525.0,"Anchorage, Alaska, United States",1996,17368,Red,BMW,No,R-Series
1940,Used,15988.0,"Arlington, Texas, United States",2016,1298,Black,Harley-Davidson,No,Softail Fat Boy
1944,Used,6000.0,"Lubbock, Texas, United States",2003,32869,Black,Harley-Davidson,No,Dyna
1945,Used,800.0,"Canterbury, Connecticut, United States",2013,12668,Black,Yamaha,No,Other
1947,Used,9795.0,"Zieglerville, Pennsylvania, United States",2010,11218,Purple,Harley-Davidson,No,Dyna
1948,Used,5000.0,"Dallas, Texas, United States",2008,34284,Black,Honda,No,Gold Wing
1949,Used,18995.0,"Norman, Oklahoma, United States",2013,3717,Other,Harley-Davidson,No,CVO™ Road King®
1950,Used,14777.0,"Manheim, Pennsylvania, United States",2015,3513,Gold,Harley-Davidson,No,Softail
1954,Used,10000.0,"Hiawassee, Georgia, United States",2015,5300,Black,Harley-Davidson,No,Softail Fat Boy
1955,Used,2195.0,"Thaxton, Virginia, United States",1975,2700,Other,Suzuki,No,Other
1956,Used,11500.0,"Dade City, Florida, United States",2003,32315,Metallic,Honda,No,Gold Wing
1959,Used,11800.0,"Springfield, Vermont, United States",2008,11300,Black,Harley-Davidson,No,FLSTN
1960,Used,1450.0,"Pinson, Tennessee, United States",1975,2828,Orange,Honda,No,ST-90
1961,Used,14977.0,"Mansfield, Texas, United States",2013,25101,Other,Harley-Davidson,No,Street Glide
1962,Used,1550.0,"Ruffs Dale, Pennsylvania, United States",1987,15000,Red,Honda,No,Gold Wing
1963,Used,5000.0,"Edwards, Missouri, United States",2000,36617,Black,Harley-Davidson,No,Dyna
1964,Used,7111.0,"Mansfield, Texas, United States",2008,20317,Red,Harley-Davidson,No,Dyna Fat Bob
1965,Used,9900.0,"Vero Beach, Florida, United States",1982,12282,Red,Honda,No,CB
1966,Used,4900.0,"Largo, Florida, United States",2016,4500,Blue,Yamaha,Yes,WR250R
1968,Used,28000.0,"Lehigh Acres, Florida, United States",2015,6200,Other,Harley-Davidson,No,tri gilde
1969,Used,3900.0,"Atwater, California, United States",2001,18300,Black,BMW,No,R-Series
1971,Used,2500.0,"Memphis, Tennessee, United States",1998,13000,Other,Honda,No,Other
1972,Used,4995.0,"Mooresville, North Carolina, United States",1997,18635,Other,Kawasaki,No,KZ1000
1973,Used,7339.0,"Arlington, Texas, United States",2001,35188,Black,Harley-Davidson,No,Road King
1974,Used,3550.0,"Utopia, Texas, United States",2002,38673,Silver,Honda,No,Gold Wing
1975,Used,5900.0,"Winona Lake, Indiana, United States",2012,4430,Black,Harley-Davidson,No,Sportster
1976,Used,520.0,"Scott City, Missouri, United States",2016,4036,Black,Harley-Davidson,Yes,Heritage Softail Classic
1977,Used,9999.0,"Twin Bridges, Montana, United States",1972,272,Black,Harley-Davidson,No,XLCH Sportster
1979,Used,22999.0,"Schertz, Texas, United States",2017,300,Red,Other,No,Slingshot
1981,Used,7500.0,"Adamstown, Maryland, United States",2012,28500,Blue,Honda,Yes,Other
