Id,Condition,Price,Location,Model_Year,Mileage,Exterior_Color,Make,Warranty,Model
3482,Used,16995.0,"Saint Petersburg, Florida, United States",2008,27967,Metallic,Harley-Davidson,No,Touring
3483,Used,14250.0,"New London, Connecticut, United States",2012,4900,Other,BMW,No,K-Series
3484,Used,6997.0,"Round Rock, Texas, United States",2005,18409,Black,Harley-Davidson,No,FLSTC - Heritage Softail Classic
3485,New,9498.0,"Barrington, Illinois, United States",2016,325,Blue,BMW,No,F-Series
3486,Used,1000.0,"Lebanon, Oregon, United States",2000,37242,Black,Honda,No,Shadow
3487,Used,10000.0,"Fair Oaks, California, United States",1999,7000,Black,Other,No,Super X
3488,Used,3999.0,"Vero Beach, Florida, United States",2003,8097,Black,Kawasaki,No,Vulcan
3491,Used,355.0,"Winterville, North Carolina, United States",2003,4975,Red,Kawasaki,No,Vulcan
3492,Used,3805.0,"Suncook, New Hampshire, United States",2001,22264,Purple,Harley-Davidson,No,Softail
3493,Used,5235.0,"Scott City, Missouri, United States",2016,1176,Black,Harley-Davidson,Yes,Dyna Fat Bob
3494,Used,6000.0,"Sierra Vista, Arizona, United States",1985,1500,Other,Harley-Davidson,No,Other
3495,Used,1500.0,"Newport, Rhode Island, United States",1975,11000,Green,Ducati,No,Bevel drive
3496,Used,6099.0,"Smyrna, Delaware, United States",2014,3700,Black,Yamaha,No,V Star
3497,Used,2296.0,"Hialeah, Florida, United States",2009,19000,Black,Yamaha,Yes,V Star
3498,Used,13977.0,"Scott City, Missouri, United States",2014,12037,Black,Harley-Davidson,No,Softail Breakout
3499,Used,5995.0,"Azusa, California, United States",2015,6651,Red,Yamaha,No,FZ
3500,Used,6000.0,"Sierra Vista, Arizona, United States",1985,1500,Other,Harley-Davidson,No,Other
3501,Used,1500.0,"Newport, Rhode Island, United States",1975,11000,Green,Ducati,No,Bevel drive
3502,Used,2605.0,"Flemington, New Jersey, United States",1972,22000,Black,Triumph,No,Bonneville
3503,Used,13977.0,"Scott City, Missouri, United States",2014,12037,Black,Harley-Davidson,No,Softail Breakout
3504,Used,10200.0,"Oklahoma City, Oklahoma, United States",2012,5800,Green,Kawasaki,No,Vulcan
3505,Used,5200.0,"Ellington, Connecticut, United States",2007,4130,Yellow,Ducati,No,Superbike
3506,Used,7900.0,"Rochester, New York, United States",2013,6800,Blue,Other,No,1300 vstar deluxe
3507,Used,4650.0,"Wilmington, North Carolina, United States",2015,5500,Other,Ducati,No,Superbike
3509,Used,5999.0,"Mansfield, Texas, United States",2011,20380,Red,Honda,No,VT1300
3513,Used,2500.0,"Grand Forks, North Dakota, United States",2006,4300,Green,Kawasaki,No,Vulcan
3514,Used,9000.0,"Athens, New York, United States",2007,9880,Black,Harley-Davidson,No,Dyna
3515,Used,5200.0,"Overland Park, Kansas, United States",2006,10949,Orange,Other,No,Other
3517,Used,4500.0,"Montclair, New Jersey, United States",1965,11790,Red,Honda,No,Super Hawk
3518,Used,3000.0,"Aspen, Colorado, United States",2009,14000,Other,Suzuki,No,DL650
3519,Used,1200.0,"Aston, Pennsylvania, United States",2000,12574,Other,Honda,No,Shadow
3520,Used,6086.0,"Chicago, Illinois, United States",2006,4495,Black,Other,No,Mastiff
3521,Used,11991.0,"Scott City, Missouri, United States",2010,1584,Blue,Harley-Davidson,No,Softail Deluxe
3523,Used,2025.0,"Marina del Rey, California, United States",2014,13586,Green,Triumph,No,Bonneville
3525,Used,900.0,"Fairfax, Virginia, United States",1983,16500,Red,Honda,No,Nighthawk
3526,Used,6300.0,"Barboursville, West Virginia, United States",2011,12800,Black,Suzuki,No,GSX-R
3527,Used,7000.0,"Damascus, Virginia, United States",2009,11000,Black,Harley-Davidson,No,Dyna
3530,Used,16500.0,"Port Charlotte, Florida, United States",2005,18000,Metallic,Custom Built Motorcycles,No,Chopper
3531,Used,6500.0,"Hillsboro, New Hampshire, United States",2012,800,Red,Honda,No,XR
3533,Used,5000.0,"Rockwood, Pennsylvania, United States",2009,4399,Black,Suzuki,No,Boulevard
3534,Used,10500.0,"Nixa, Missouri, United States",2009,17063,Other,Custom Built Motorcycles,No,Other
3535,Used,19488.0,"Austin, TX, United States",2009,37515,Red,Harley-Davidson,No,Touring
3536,Used,810.0,"Suncook, New Hampshire, United States",2005,28345,Black,Suzuki,No,V-Strom
3538,Used,3900.0,"Palisades, New York, United States",1995,32905,Red,BMW,No,K-Series
3539,Used,4199.0,"Panama City, Florida, United States",2009,6477,Red,Yamaha,No,V Star
3542,Used,4500.0,"Stanwood, Washington, United States",1980,11000,Black,Yamaha,No,XS
3543,Used,2650.0,"Marco Island, Florida, United States",2001,9500,White,Suzuki,No,Hayabusa
3544,Used,600.0,"Monroe City, Missouri, United States",1973,3173,Other,Suzuki,No,RV
3545,Used,4510.0,"Pompano Beach, Florida, United States",2006,10273,Yellow,Triumph,No,Daytona 675
3546,Used,8875.0,"Arlington, Texas, United States",2016,1502,Red,Suzuki,No,GSX-R
3547,Used,1300.0,"Greensboro, North Carolina, United States",2005,483,Red,Honda,No,XR
3549,Used,14999.0,"Miami, Florida, United States",2016,2550,Black,Indian,No,Chief
3550,Used,16800.0,"El Segundo, California, United States",1986,15200,Other,Suzuki,No,RG500
3551,Used,2605.0,"Flemington, New Jersey, United States",1972,22000,Black,Triumph,No,Bonneville
3554,Used,8800.0,"Middletown, Connecticut, United States",2013,4300,Red,Ducati,No,Superbike
3555,Used,6000.0,"Miami, Florida, United States",2006,14322,Red,Yamaha,No,Stratoliner
3556,Used,14991.0,"Scott City, Missouri, United States",2015,1350,Blue,Harley-Davidson,No,Touring
3557,Used,5750.0,"Brentwood, Tennessee, United States",2007,15900,Red,Yamaha,No,FJR
3558,Used,3200.0,"Westminster, Maryland, United States",2002,1951,Green,Kawasaki,No,KLR
3560,Used,1162.0,"Acworth, Georgia, United States",2002,33200,Black,Honda,No,VTX
3561,Used,7900.0,"Rochester, New York, United States",2013,6800,Blue,Other,No,1300 vstar deluxe
3562,Used,5500.0,"Fairfield, Connecticut, United States",2010,10230,Silver,Honda,No,Fury
3567,Used,2995.0,"Round Rock, Texas, United States",2007,6300,Other,Honda,No,Shadow
3570,Used,17992.0,"Round Rock, Texas, United States",2015,2437,--,Indian,No,Roadmaster Thunder Black
3571,Used,11200.0,"Elyria, Ohio, United States",2002,12000,Yellow,Indian,No,Indian
3572,Used,6800.0,"Merrimack, New Hampshire, United States",2010,1913,Blue,Yamaha,No,Raider
3574,Used,7595.0,"Orlando, Florida, United States",2009,8388,Other,Yamaha,No,YZF-R
3575,Used,2025.0,"Marina del Rey, California, United States",2014,13586,Green,Triumph,No,Bonneville
3576,Used,3051.0,"Bellmore, New York, United States",2013,511,Red,Suzuki,No,Boulevard
3577,Used,2495.0,"Brewster, Ohio, United States",2007,4465,Other,Kawasaki,No,Vulcan
3578,Used,6490.0,"Round Rock, Texas, United States",2005,14646,Red,Harley-Davidson,No,FLSTF - Softail Fat Boy
3580,Used,13500.0,"Hollywood, Florida, United States",2001,411,Black,Indian,No,Scout
3582,Used,1050.0,"Adairsville, Georgia, United States",2015,2648,Yellow,Suzuki,No,DR200 SL5
3583,Used,14999.0,"San Rafael, California, United States",2016,2800,Red,BMW,Yes,S1000RR
3584,Used,7600.0,"Blue Bell, Pennsylvania, United States",2006,2600,Silver,Custom Built Motorcycles,No,Chopper
3585,Used,5000.0,"La Jolla, California, United States",2001,5000,Red,Honda,No,XR
3586,Used,3500.0,"North Hollywood, California, United States",1991,24606,Blue,Suzuki,No,GSX-R
3587,Used,1000.0,"Greeley, Colorado, United States",1989,1706,Red,Suzuki,No,GSX-R
3588,Used,5000.0,"Rockwood, Pennsylvania, United States",2009,4399,Black,Suzuki,No,Boulevard
3589,Used,12875.0,"Palmdale, California, United States",2012,10000,Blue,Harley-Davidson,No,FLHTK - Electra Glide® Ultra Limited
3591,Used,2325.0,"Philo, Ohio, United States",2005,697,Black,Honda,No,VTX
3593,Used,12000.0,"Fremont, Michigan, United States",2014,8097,Silver,Ducati,No,Diavel
3594,Used,8250.0,"San Tan Valley, Arizona, United States",1998,27900,Black,Honda,No,Valkyrie
3595,Used,4199.0,"Panama City, Florida, United States",2009,6477,Red,Yamaha,No,V Star
3596,Used,1825.0,"San Antonio, Texas, United States",1996,17964,Black,Yamaha,No,V Max
3597,Used,5999.0,"Mansfield, Texas, United States",2011,14280,Red,Kawasaki,No,Verseys
3598,Used,2025.0,"Suncook, New Hampshire, United States",2010,20007,Red,Honda,No,Fury
3600,Used,3500.0,"North Hollywood, California, United States",1991,24606,Blue,Suzuki,No,GSX-R
3601,Used,1000.0,"Greeley, Colorado, United States",1989,1706,Red,Suzuki,No,GSX-R
3602,Used,12875.0,"Palmdale, California, United States",2012,10000,Blue,Harley-Davidson,No,FLHTK - Electra Glide® Ultra Limited
3604,Used,2325.0,"Philo, Ohio, United States",2005,697,Black,Honda,No,VTX
3605,Used,12000.0,"Fremont, Michigan, United States",2014,8097,Silver,Ducati,No,Diavel
3606,Used,2025.0,"Suncook, New Hampshire, United States",2010,20007,Red,Honda,No,Fury
3607,Used,11990.0,"Mesquite, Texas, United States",2007,17000,Blue,Suzuki,No,Hayabusa
3608,Used,455.0,"McHenry, Illinois, United States",2004,9950,Red,Honda,No,VTX
3611,Used,7995.0,"Springfield, Missouri, United States",2014,3124,Red,Honda,No,Fury
3612,Used,2595.0,"Homestead, Florida, United States",1969,7489,Red,Honda,No,CL
3613,Used,3300.0,"Winston-Salem, North Carolina, United States",2009,3418,Other,Honda,No,Shadow
3614,Used,3478.0,"Mountain Home, Arkansas, United States",2009,9794,Black,Suzuki,No,Burgman 650
3615,Used,2700.0,"Central Islip, New York, United States",2009,17321,Blue,Honda,No,Shadow
3618,Used,7500.0,"Georgetown, Texas, United States",2000,6500,Black,Other,No,Arlen Ness Ultra Custom
3621,Used,10000.0,"Clairton, Pennsylvania, United States",2009,2500,Purple,Suzuki,No,Boulevard
3622,Used,1.0,"Carol Stream, Illinois, United States",2004,4400,Other,Honda,No,CBR
3623,Used,3150.0,"Cape Coral, Florida, United States",2014,1337,Blue,Yamaha,No,Stryker
3625,Used,5500.0,"Tawas City, Michigan, United States",2016,500,Green,Kawasaki,No,KX
3626,Used,500.0,"Scott City, Missouri, United States",2015,756,Black,Harley-Davidson,Yes,Sportster Seventy-two
3628,Used,4995.0,"Vero Beach, Florida, United States",2013,2009,Gray,Suzuki,No,Boulevard
3629,Used,9000.0,"Astoria, New York, United States",2009,2600,White,Ducati,No,Superbike
3630,Used,760.0,"Vernon-Rockville, Connecticut, United States",1988,5139,White,Yamaha,No,YSR50
3631,Used,2500.0,"Williamstown, West Virginia, United States",1977,378,Other,Honda,No,CT
3632,Used,6500.0,"Marana, Arizona, United States",2007,1200,Other,Harley-Davidson,No,Sportster
3633,Used,4700.0,"Cape Coral, Florida, United States",2009,9320,Black,Harley-Davidson,No,Sportster
3634,Used,100.0,"Garfield, Arkansas, United States",2002,5620,Black,Yamaha,No,V Star
3635,Used,3000.0,"Prospect, Connecticut, United States",2002,7839,Silver,Honda,No,Sabre VT1100C2
3636,Used,19999.0,"Miami, Florida, United States",2016,166,Red,Indian,No,Chief
3637,Used,16000.0,"Fort Lauderdale, Florida, United States",2007,16800,Other,Yamaha,No,Stratoliner
3638,Used,5888.0,"Tampa, Florida, United States",2011,13267,Orange,Harley-Davidson,No,Sportster
3639,Used,2500.0,"Yulee, Florida, United States",2005,11200,Red,Honda,No,Shadow
3641,Used,4995.0,"Miami, Florida, United States",2012,11130,Green,Kawasaki,No,Ninja
3642,Used,6900.0,"Ridgeland, Mississippi, United States",2014,13837,Metallic,Yamaha,No,FZ
3643,Used,3200.0,"Big Pine Key, Florida, United States",2007,24000,Gray,Honda,No,Shadow
3644,Used,3249.0,"Naples, Florida, United States",2014,8799,Other,Harley-Davidson,No,Sportster
3645,Used,700.0,"Paramus, New Jersey, United States",1995,4043,Red,Yamaha,No,Virago
3647,Used,15000.0,"Fort Lauderdale, Florida, United States",2015,3400,Black,BMW,Yes,K1600GTL
3648,Used,3210.0,"Adairsville, Georgia, United States",2004,5301,Black,Other,No,RSV1000R FACTORY
3649,Used,7450.0,"McAllen, Texas, United States",2009,16902,Black,Harley-Davidson,No,Dyna
3650,Used,2332.0,"Pittsburgh, Pennsylvania, United States",1998,12829,Red,Triumph,No,Thunderbird Sport
3651,Used,14000.0,"Miami, Florida, United States",1948,4999,Blue,Other,No,S7 Early Model
3652,Used,2495.0,"Brewster, Ohio, United States",2007,4465,Other,Kawasaki,No,Vulcan
3653,Used,10995.0,"Orlando, Florida, United States",2016,6273,Other,Suzuki,No,GSX-R1000 Commemorative Edition
3654,Used,1025.0,"Suncook, New Hampshire, United States",2012,9083,Black,Honda,No,Shadow
3655,Used,17992.0,"Round Rock, Texas, United States",2015,2437,--,Indian,No,Roadmaster Thunder Black
3656,Used,11200.0,"Elyria, Ohio, United States",2002,12000,Yellow,Indian,No,Indian
3657,Used,6800.0,"Merrimack, New Hampshire, United States",2010,1913,Blue,Yamaha,No,Raider
3659,Used,5700.0,"Collierville, Tennessee, United States",2006,3700,Red,Harley-Davidson,No,V-Rod
3661,Used,3051.0,"Bellmore, New York, United States",2013,511,Red,Suzuki,No,Boulevard
3662,Used,2800.0,"Tazewell, Virginia, United States",2005,13037,Red,Yamaha,No,V Star
3664,Used,13500.0,"Hollywood, Florida, United States",2001,411,Black,Indian,No,Scout
3665,Used,6100.0,"Brooklyn, New York, United States",2009,22000,Black,Harley-Davidson,No,Sportster
3666,Used,7500.0,"Reinholds, Pennsylvania, United States",2012,5056,Black,Suzuki,No,V-STROM ABS
3667,Used,7500.0,"Fredericksburg, Virginia, United States",2008,2300,Metallic,Harley-Davidson,No,Dyna Lowrider
3668,Used,7700.0,"Forest, Ohio, United States",2006,12553,Blue,Other,No,Mastiff
3669,Used,8250.0,"San Tan Valley, Arizona, United States",1998,27900,Black,Honda,No,Valkyrie
3671,Used,1825.0,"San Antonio, Texas, United States",1996,17964,Black,Yamaha,No,V Max
3672,Used,5999.0,"Mansfield, Texas, United States",2011,14280,Red,Kawasaki,No,Verseys
3673,Used,11990.0,"Mesquite, Texas, United States",2007,17000,Blue,Suzuki,No,Hayabusa
3674,Used,22000.0,"St. George, Utah, United States",2015,2074,--,Harley-Davidson,No,Softail
3675,Used,5700.0,"Stafford, Virginia, United States",2013,2684,Black,BMW,No,C650
3676,Used,9000.0,"Los Angeles, California, United States",2008,5700,White,Ducati,No,Superbike
3677,Used,9791.0,"Scott City, Missouri, United States",2008,14320,Silver,Harley-Davidson,No,Heritage Softail Classic
3678,Used,5999.0,"Dahlonega, Georgia, United States",2001,20693,Black,Honda,No,Valkyrie
3679,Used,7300.0,"Whitehall, Pennsylvania, United States",2008,3860,White,Ducati,No,Superbike
3680,Used,7500.0,"Georgetown, Texas, United States",2000,6500,Black,Other,No,Arlen Ness Ultra Custom
3681,Used,10000.0,"Penticton, British Columbia, Canada",1998,3160,Other,Harley-Davidson,No,Ultra Classic
3683,Used,5500.0,"Tawas City, Michigan, United States",2016,500,Green,Kawasaki,No,KX
3684,Used,10777.0,"Miami, Florida, United States",2014,4087,Metallic,Kawasaki,No,Vulcan
3685,Used,4000.0,"Fort Smith, Arkansas, United States",2009,10450,Red,Yamaha,No,Raider
3687,Used,1400.0,"Garrison, New York, United States",1978,5994,Black,Suzuki,No,550 GSL
3688,Used,4500.0,"League City, Texas, United States",2009,31000,Black,Yamaha,No,FJR
3689,Used,1100.0,"Kingmont, West Virginia, United States",2006,3400,Other,Suzuki,No,Boulevard
3690,Used,100.0,"Garfield, Arkansas, United States",2002,5620,Black,Yamaha,No,V Star
3691,Used,3000.0,"Prospect, Connecticut, United States",2002,7839,Silver,Honda,No,Sabre VT1100C2
3692,Used,6900.0,"Spring, Texas, United States",2008,10000,White,Ducati,No,Superbike
3693,Used,19999.0,"Miami, Florida, United States",2016,166,Red,Indian,No,Chief
3694,Used,4450.0,"Jacksonville, Florida, United States",2015,1490,Blue,Honda,No,CT
3695,Used,7000.0,"Philadelphia, Pennsylvania, United States",2008,17000,Red,Ducati,No,Superbike
3696,Used,1200.0,"Port Royal, Pennsylvania, United States",2004,31000,Gray,Kawasaki,No,Vulcan
3697,Used,6900.0,"Ridgeland, Mississippi, United States",2014,13837,Metallic,Yamaha,No,FZ
3699,Used,14980.0,"Round Rock, Texas, United States",2016,3096,Gold,Harley-Davidson,No,Softail
3702,Used,975.0,"Rochester, New York, United States",2001,8516,Red,Kawasaki,No,Vulcan
3703,Used,10995.0,"Orlando, Florida, United States",2016,6273,Other,Suzuki,No,GSX-R1000 Commemorative Edition
3704,Used,1025.0,"Suncook, New Hampshire, United States",2012,9083,Black,Honda,No,Shadow
3708,Used,6999.0,"Wichita Falls, Texas, United States",2015,1634,Gray,Yamaha,No,FJR
3710,Used,5700.0,"Collierville, Tennessee, United States",2006,3700,Red,Harley-Davidson,No,V-Rod
3711,Used,1500.0,"Lynnwood, Washington, United States",1982,15038,Blue,Honda,No,CM450E
3712,Used,5100.0,"Hawley, Pennsylvania, United States",2014,200,Blue,Yamaha,No,WR
3713,Used,1000.0,"Virginia Beach, Virginia, United States",1985,21000,Red,Honda,No,Magna
3714,Used,11000.0,"Selden, New York, United States",2009,9806,Orange,Custom Built Motorcycles,No,Chopper
3715,Used,12450.0,"Round Rock, Texas, United States",2014,34086,Blue,Indian,No,Chief Vintage Springfield Blue
3716,Used,3999.0,"Arlington, Texas, United States",2004,12686,Red,Honda,No,Interceptor
3717,Used,2225.0,"Stroudsburg, Pennsylvania, United States",1982,1300,Black,Custom Built Motorcycles,No,Bobber
3718,Used,250.0,"Suncook, New Hampshire, United States",2014,4632,Black,Indian,No,Chief
3719,Used,39995.0,"West Point, California, United States",1933,350,Other,Indian,No,Chief
3720,Used,2395.0,"Greenacres, Washington, United States",1970,1308,Blue,Honda,No,CT
3721,Used,10888.0,"Dundalk, Maryland, United States",2005,5506,Black,Harley-Davidson,No,Softail
3722,Used,7700.0,"Forest, Ohio, United States",2006,12553,Blue,Other,No,Mastiff
3723,Used,4000.0,"Kent, Ohio, United States",2007,24000,Red,Kawasaki,No,Vulcan
3724,Used,2500.0,"Swansea, South Carolina, United States",1964,2746,Black,Honda,No,CL
3727,Used,1800.0,"Elkton, Maryland, United States",1972,13367,Red,Yamaha,No,XS
3728,Used,1550.0,"McHenry, Illinois, United States",2015,3234,Black,Ducati,No,Diavel
3731,Used,3450.0,"Huntingdon Valley, Pennsylvania, United States",2008,988,Black,Suzuki,No,Boulevard
3732,Used,4500.0,"Whitehouse Station, New Jersey, United States",2007,7500,Black,Kawasaki,No,Vulcan
3733,Used,9080.0,"New Britain, Connecticut, United States",2009,8500,Orange,Suzuki,No,Hayabusa
3734,Used,9000.0,"Los Angeles, California, United States",2008,5700,White,Ducati,No,Superbike
3735,Used,9791.0,"Scott City, Missouri, United States",2008,14320,Silver,Harley-Davidson,No,Heritage Softail Classic
3736,Used,7000.0,"Sparrow Bush, New York, United States",1999,31000,Orange,Harley-Davidson,No,Softail
3738,Used,7300.0,"Whitehall, Pennsylvania, United States",2008,3860,White,Ducati,No,Superbike
3740,Used,10000.0,"Penticton, British Columbia, Canada",1998,3160,Other,Harley-Davidson,No,Ultra Classic
3741,Used,500.0,"Rohnert Park, California, United States",1971,4088,Blue,Honda,No,CL
3742,Used,2400.0,"LaGrange, Georgia, United States",2009,999,Green,Kawasaki,No,KX
3743,Used,2999.0,"Santa Fe Springs, California, United States",2011,150,Blue,Yamaha,No,WR
3744,Used,1400.0,"Garrison, New York, United States",1978,5994,Black,Suzuki,No,550 GSL
3746,Used,2399.0,"Fort Collins, Colorado, United States",1985,24000,Blue,Yamaha,No,V Max
3747,Used,2700.0,"Boston, Massachusetts, United States",1994,36100,Red,BMW,No,K-Series
3748,Used,2299.0,"Bridgewater, New Jersey, United States",1997,25027,Other,BMW,No,F-Series
3749,Used,3900.0,"Boca Raton, Florida, United States",1991,21239,Black,BMW,No,K-Series
3750,Used,4999.0,"Fair Haven, Vermont, United States",2008,16500,Black,Kawasaki,No,Vulcan
3751,Used,2900.0,"Salem, Illinois, United States",1999,152,Blue,Other,No,BULLET 500
3752,Used,5900.0,"Locust Valley, New York, United States",2013,2847,Black,Ducati,No,Monster
3753,Used,2325.0,"Suncook, New Hampshire, United States",2005,30235,Black,Harley-Davidson,No,Softail
3754,Used,17000.0,"Matthews, North Carolina, United States",2007,3800,Black,Custom Built Motorcycles,No,Pro Street
3755,Used,4000.0,"Georgetown, Texas, United States",2012,1550,White,Yamaha,No,FZ
3756,Used,3750.0,"Watsonville, California, United States",1966,5206,Red,Yamaha,No,YM1
3757,Used,3550.0,"Webb City, Missouri, United States",2008,18515,Black,Yamaha,No,V Star
3758,Used,5995.0,"Hibbing, Minnesota, United States",2008,5477,Black,Suzuki,No,Boulevard
3760,Used,5200.0,"Redding, California, United States",2006,6930,Red,Yamaha,No,V Star
3762,Used,18000.0,"Livonia, Michigan, United States",2013,5000,Green,Ducati,No,Monster
3763,Used,4000.0,"Holyoke, Massachusetts, United States",2009,8720,Black,Yamaha,No,V Star
3764,Used,2200.0,"Oxnard, California, United States",2001,23345,Black,Other,No,ET4
3767,Used,975.0,"Rochester, New York, United States",2001,8516,Red,Kawasaki,No,Vulcan
3768,Used,3550.0,"Collierville, Tennessee, United States",2010,7102,Red,Honda,No,Other
3771,Used,1500.0,"Yorktown Heights, New York, United States",1988,26489,Red,Ducati,No,Superbike
3773,Used,700.0,"Valley City, Ohio, United States",1982,2018,Black,Suzuki,No,Sp250
3774,Used,8000.0,"Orange City, Iowa, United States",2009,8900,Orange,Yamaha,No,Raider
3775,Used,2550.0,"Oviedo, Florida, United States",1967,24150,Black,Honda,No,Super Hawk
3776,Used,2395.0,"Greenacres, Washington, United States",1970,1308,Blue,Honda,No,CT
3777,Used,26999.0,"Miami, Florida, United States",2017,200,Orange,Other,No,SLR Orange Madness
3778,Used,10888.0,"Dundalk, Maryland, United States",2005,5506,Black,Harley-Davidson,No,Softail
3779,Used,11200.0,"Eden Prairie, Minnesota, United States",2013,3205,Red,Ducati,No,Superbike
3780,Used,2025.0,"Everett, Massachusetts, United States",2002,1306,Orange,Custom Built Motorcycles,No,Chopper
3781,Used,4000.0,"Kent, Ohio, United States",2007,24000,Red,Kawasaki,No,Vulcan
3782,Used,20000.0,"Fort Dodge, Iowa, United States",2016,1000,Red,Custom Built Motorcycles,No,Chopper
3783,Used,3500.0,"Glen Burnie, Maryland, United States",1996,5000,Black,Harley-Davidson,No,Sportster 883
3784,Used,3500.0,"Winnsboro, Texas, United States",2002,17013,Blue,Yamaha,No,V Star
3785,Used,4700.0,"Montoursville, Pennsylvania, United States",2011,1800,Red,Ducati,No,Hypermotard
3786,Used,2550.0,"Suncook, New Hampshire, United States",2013,8407,Black,Honda,No,Fury
3787,New,4050.0,"Boston, Massachusetts, United States",2011,13000,Black,Ducati,No,Superbike
3788,Used,10877.0,"Scott City, Missouri, United States",2012,7239,Black,Harley-Davidson,Yes,Dyna Street Bob
3789,Used,2025.0,"Denver, North Carolina, United States",2007,24343,Red,Suzuki,No,Hayabusa
3790,Used,9900.0,"Norfolk, Virginia, United States",2015,662,White,Ducati,No,Diavel Carbon
3791,New,10450.0,"Norman, Oklahoma, United States",2016,2494,Other,Indian,No,Scout™ ABS
3792,Used,2100.0,"Springfield, Missouri, United States",1974,28717,Blue,Yamaha,No,XS
3796,Used,1500.0,"Franklin, Ohio, United States",1982,22817,Blue,Suzuki,No,GS
3797,Used,4500.0,"Whitehouse Station, New Jersey, United States",2007,7500,Black,Kawasaki,No,Vulcan
3798,Used,20000.0,"Seal Beach, California, United States",1947,500,Other,Harley-Davidson,No,Servi Car
3800,Used,7000.0,"Sparrow Bush, New York, United States",1999,31000,Orange,Harley-Davidson,No,Softail
3802,Used,1000.0,"Greenville, South Carolina, United States",1987,15000,Other,Yamaha,No,FZ
3803,Used,16333.0,"Arlington, Texas, United States",2014,2955,Black,Indian,No,Chieftain
3804,Used,10000.0,"Orlando, Florida, United States",2003,6310,White,Suzuki,No,Hayabusa
3805,Used,3200.0,"Franklin, Tennessee, United States",2007,37800,Black,Suzuki,No,DL650 V-Strom
3806,Used,6000.0,"San Antonio, Texas, United States",2005,27200,Gray,Suzuki,No,Hayabusa
3808,Used,2299.0,"Bridgewater, New Jersey, United States",1997,25027,Other,BMW,No,F-Series
3809,Used,3550.0,"Suncook, New Hampshire, United States",2013,13959,Black,Kawasaki,No,Vulcan
3810,Used,3999.0,"New Haven, Connecticut, United States",2009,5610,Red,Kawasaki,No,Vulcan
3811,Used,2763.0,"Cape Coral, Florida, United States",2001,6702,Black,Harley-Davidson,No,Softail
3812,Used,3099.0,"Fort Mitchell, Kentucky, United States",2011,361,White,Yamaha,No,YZ
3814,Used,5500.0,"Salt Lake City, Utah, United States",2000,12211,Red,Ducati,No,966 S
3815,Used,22365.0,"ski, akerhus, Norway",1996,3000,Other,Harley-Davidson,No,Other
3816,Used,3600.0,"Oxon Hill, Maryland, United States",2010,8000,White,Ducati,No,Superbike
3817,Used,5995.0,"Hibbing, Minnesota, United States",2008,5477,Black,Suzuki,No,Boulevard
3818,Used,5500.0,"Walla Walla, Washington, United States",2012,804,Orange,Kawasaki,No,Vulcan
3819,Used,3500.0,"Sturgis, South Dakota, United States",1979,33190,Other,Yamaha,No,XS
3822,Used,14997.0,"Dallas, Texas, United States",2016,1410,Black,Harley-Davidson,No,FLSTFB - Softail Fat Boy Lo
3823,Used,18999.0,"Rockville, Maryland, United States",2016,2234,Black,Ducati,Yes,XDiavel
3824,Used,6849.0,"Ridgeland, Mississippi, United States",2011,20879,Black,Suzuki,No,1250 FA
3825,Used,2299.0,"Lowell, Massachusetts, United States",2002,9000,Black,Kawasaki,No,Vulcan
3826,Used,2500.0,"Allentown, Pennsylvania, United States",1962,4956,Other,Honda,No,CA
3828,Used,9000.0,"New Rochelle, New York, United States",2009,1200,Red,Yamaha,No,Road Star
3829,Used,8500.0,"Hollywood, Florida, United States",2001,3396,Red,Suzuki,No,Hayabusa
3830,Used,9999.0,"Summerland Key, Florida, United States",2005,1200,Blue,Custom Built Motorcycles,No,Chopper
3831,Used,3550.0,"Collierville, Tennessee, United States",2010,7102,Red,Honda,No,Other
3832,Used,1735.0,"La Quinta, California, United States",1962,3619,Black,Honda,No,CA
3834,Used,3095.0,"Hollidaysburg, Pennsylvania, United States",2006,4400,Red,Suzuki,No,SV
3835,Used,3499.0,"Exeter, New Hampshire, United States",2007,13300,Black,Yamaha,No,V Star
3836,Used,455.0,"Suncook, New Hampshire, United States",2012,15047,Red,Kawasaki,No,ZG1400 CONCOURS 1400 W/ABS
3837,Used,21000.0,"Spencerport, New York, United States",2013,6400,Brown,Harley-Davidson,No,Trike
3838,Used,8000.0,"Orange City, Iowa, United States",2009,8900,Orange,Yamaha,No,Raider
3839,Used,5000.0,"Mooresville, North Carolina, United States",2017,250,Other,Suzuki,No,Hayabusa
3840,Used,10000.0,"Buenos Aires City, Argentina",1938,4000,Green,Other,No,VELOCETTE MSS-500 With Sidecar
3841,Used,4000.0,"Melbourne, Florida, United States",2006,9800,Black,Suzuki,No,Hayabusa
3842,Used,3200.0,"Huntington Station, New York, United States",2006,17000,Other,Yamaha,No,Road Star
3843,Used,4700.0,"Claremont, North Carolina, United States",2002,17800,Orange,Yamaha,No,V Star
